{
  "generated_at": "2026-04-10T19:20:00Z",
  "generator_name": "concept-packet-stub",
  "generator_version": "concept-packet-stub-v0.2.0",
  "manifest_id": "gm_20260410_a1b2c3",
  "notes": null,
  "output_artifacts": [
    {
      "hash": "sha256:9a56dbd447b2989b4260d23c5bc89a99ffd4bcbfe3e9bea8cba0abcd764dbbef",
      "kind": "concept_packet_draft",
      "path": "generated/drafts/example-game/concept_packet.draft.json"
    }
  ],
  "request_id": "gr_20260410_a1b2c3",
  "schema_version": "0.1.0",
  "schema_versions_used": {
    "build_plan_schema": null,
    "concept_brief_schema": "0.1.0",
    "generation_manifest_schema": "0.1.0",
    "generation_request_schema": "0.1.0"
  },
  "source_artifacts": [
    {
      "hash": "sha256:78ef4a669468802c38ec8779e12719aa6e9e44b70385bb287e181eb5f1a04060",
      "kind": "concept_brief",
      "path": "schemas/examples/concept_brief.example.json"
    }
  ],
  "status": "success"
}
