{
  "generated_at": "2026-04-10T19:20:00Z",
  "generator_name": "concept-packet-stub",
  "generator_version": "concept-packet-stub-v0.2.0",
  "manifest_id": "gm_20260410_sls001",
  "notes": null,
  "output_artifacts": [
    {
      "hash": "sha256:afc14744b0acffd503d5639114218dcd089608d08473d80d531c7dcf2ca1bb6d",
      "kind": "concept_packet_draft",
      "path": "generated/drafts/snack-line-shuffle-mini/concept_packet.draft.json"
    }
  ],
  "request_id": "gr_20260410_sls001",
  "schema_version": "0.1.0",
  "schema_versions_used": {
    "build_plan_schema": null,
    "concept_brief_schema": "0.1.0",
    "generation_manifest_schema": "0.1.0",
    "generation_request_schema": "0.1.0"
  },
  "source_artifacts": [
    {
      "hash": "sha256:5f41d5a812a81d5bbfb09fd1e727f250a331ad46d86e8f87453ebbfdbbd6634b",
      "kind": "concept_brief",
      "path": "generated/requests/snack-line-shuffle-mini/concept_brief.real.json"
    }
  ],
  "status": "success"
}
