{
  "generated_at": "2026-04-10T18:00:00Z",
  "generator_name": "concept-packet-stub",
  "generator_version": "concept-packet-stub-v0.1.0",
  "manifest_id": "gm_20260410_brm001",
  "notes": null,
  "output_artifacts": [
    {
      "hash": "sha256:a423a06f151ea48c3ec1baa701de389bc10dc4358c8d627e148d60f7d5b52558",
      "kind": "concept_packet_draft",
      "path": "generated/drafts/bakery-rush-mini/concept_packet.draft.json"
    }
  ],
  "request_id": "gr_20260410_brm001",
  "schema_version": "0.1.0",
  "schema_versions_used": {
    "build_plan_schema": null,
    "concept_brief_schema": "0.1.0",
    "generation_manifest_schema": "0.1.0",
    "generation_request_schema": "0.1.0"
  },
  "source_artifacts": [
    {
      "hash": "sha256:b65eda7e4d3143be45992de431914e7a0188df63815199a1ece35ade673a4b14",
      "kind": "concept_brief",
      "path": "generated/requests/bakery-rush-mini/concept_brief.real.json"
    }
  ],
  "status": "success"
}
