{
  "generated_at": "2026-04-10T20:15:00Z",
  "generator_name": "concept-packet-stub",
  "generator_version": "concept-packet-stub-v0.2.0",
  "manifest_id": "gm_20260410_nbb001",
  "notes": null,
  "output_artifacts": [
    {
      "hash": "sha256:77f21e8229dbe0aa7d077de8feab17d79b79ab8207ca177de153a83d050c00a8",
      "kind": "concept_packet_draft",
      "path": "generated/drafts/number-bond-bridge-mini/concept_packet.draft.json"
    }
  ],
  "request_id": "gr_20260410_nbb001",
  "schema_version": "0.1.0",
  "schema_versions_used": {
    "build_plan_schema": null,
    "concept_brief_schema": "0.1.0",
    "generation_manifest_schema": "0.1.0",
    "generation_request_schema": "0.1.0"
  },
  "source_artifacts": [
    {
      "hash": "sha256:f987b9e142296b11b4403d45204eabd192dd5311cf1d3519ce7a499b6b834d5f",
      "kind": "concept_brief",
      "path": "generated/requests/number-bond-bridge-mini/concept_brief.real.json"
    }
  ],
  "status": "success"
}
